<?xml version="1.0" encoding="UTF-8"?>
<xs:schema xmlns:xs="http://www.w3.org/2001/XMLSchema">
    <xs:element name="company">
        <xs:complexType>
            <xs:sequence>
                <xs:element name="employee" maxOccurs="unbounded">
                    <xs:complexType>
                        <xs:sequence>
                            <xs:element name="Emp-id" type="xs:integer"/>
                            <xs:element name="Emp-name" type="xs:string"/>
                            <xs:element name="Emp-age" type="xs:integer"/>
                            <xs:element name="Emp-salary" type="xs:integer"/>
                            <xs:element name="Emp-email" type="xs:string"/>
                            <xs:element name="Emp-phone" type="xs:string"/>
                            <xs:element name="Emp-designation" type="xs:string"/>
                        </xs:sequence>
                    </xs:complexType>
                </xs:element>
            </xs:sequence>
        </xs:complexType>
    </xs:element>
</xs:schema>